[INFO] Scanning for projects...
[INFO] 
[INFO] --------------------------< com.cartify:auto >--------------------------
[INFO] Building auto 1.0-SNAPSHOT
[INFO]   from pom.xml
[INFO] --------------------------------[ jar ]---------------------------------
[INFO] 
[INFO] --- resources:3.3.1:resources (default-resources) @ auto ---
[INFO] skip non existing resourceDirectory /Users/abdallah/Java Automaiton/java-Automation/auto/src/main/resources
[INFO] 
[INFO] --- compiler:3.11.0:compile (default-compile) @ auto ---
[INFO] Nothing to compile - all classes are up to date
[INFO] 
[INFO] --- resources:3.3.1:testResources (default-testResources) @ auto ---
[INFO] skip non existing resourceDirectory /Users/abdallah/Java Automaiton/java-Automation/auto/src/test/resources
[INFO] 
[INFO] --- compiler:3.11.0:testCompile (default-testCompile) @ auto ---
[INFO] Nothing to compile - all classes are up to date
[INFO] 
[INFO] --- surefire:3.2.2:test (default-test) @ auto ---
[INFO] Using auto detected provider org.apache.maven.surefire.testng.TestNGProvider
[INFO] 
[INFO] -------------------------------------------------------
[INFO]  T E S T S
[INFO] -------------------------------------------------------
[INFO] Running com.company.cartify.tests.CartPageTest
DEBUG: Current URL: https://cartify0.netlify.app/cartpage
DEBUG: Page Title: Shopping Cart
Screenshot saved: /Users/abdallah/Java Automaiton/java-Automation/auto/screenshots/failed_testCartPageLoadsSuccessfully.png
Screenshot saved: /Users/abdallah/Java Automaiton/java-Automation/auto/screenshots/failed_testEmptyCartDisplaysMessage.png
Screenshot saved: /Users/abdallah/Java Automaiton/java-Automation/auto/screenshots/failed_testStartShoppingRedirectsToProducts.png
Screenshot saved: /Users/abdallah/Java Automaiton/java-Automation/auto/screenshots/failed_testUnableToAddProductToCart.png
Displayed count: 0
Actual count: 0
Screenshot saved: /Users/abdallah/Java Automaiton/java-Automation/auto/screenshots/failed_testProceedToCheckoutButton.png
Screenshot saved: /Users/abdallah/Java Automaiton/java-Automation/auto/screenshots/failed_testContinueShoppingButton.png
[ERROR] Tests run: 7, Failures: 6, Errors: 0, Skipped: 0, Time elapsed: 70.24 s <<< FAILURE! -- in com.company.cartify.tests.CartPageTest
[ERROR] com.company.cartify.tests.CartPageTest.testCartPageLoadsSuccessfully -- Time elapsed: 0.289 s <<< FAILURE!
java.lang.AssertionError: Cart container should be displayed expected [true] but found [false]
	at org.testng.Assert.fail(Assert.java:111)
	at org.testng.Assert.failNotEquals(Assert.java:1578)
	at org.testng.Assert.assertTrue(Assert.java:57)
	at com.company.cartify.tests.CartPageTest.testCartPageLoadsSuccessfully(CartPageTest.java:43)
	at java.base/jdk.internal.reflect.DirectMethodHandleAccessor.invoke(DirectMethodHandleAccessor.java:104)
	at java.base/java.lang.reflect.Method.invoke(Method.java:565)
	at org.testng.internal.invokers.MethodInvocationHelper.invokeMethod(MethodInvocationHelper.java:141)
	at org.testng.internal.invokers.TestInvoker.invokeMethod(TestInvoker.java:686)
	at org.testng.internal.invokers.TestInvoker.invokeTestMethod(TestInvoker.java:230)
	at org.testng.internal.invokers.MethodRunner.runInSequence(MethodRunner.java:63)
	at org.testng.internal.invokers.TestInvoker$MethodInvocationAgent.invoke(TestInvoker.java:992)
	at org.testng.internal.invokers.TestInvoker.invokeTestMethods(TestInvoker.java:203)
	at org.testng.internal.invokers.TestMethodWorker.invokeTestMethods(TestMethodWorker.java:154)
	at org.testng.internal.invokers.TestMethodWorker.run(TestMethodWorker.java:134)
	at java.base/java.util.ArrayList.forEach(ArrayList.java:1604)
	at org.testng.TestRunner.privateRun(TestRunner.java:739)
	at org.testng.TestRunner.run(TestRunner.java:614)
	at org.testng.SuiteRunner.runTest(SuiteRunner.java:421)
	at org.testng.SuiteRunner.runSequentially(SuiteRunner.java:413)
	at org.testng.SuiteRunner.privateRun(SuiteRunner.java:373)
	at org.testng.SuiteRunner.run(SuiteRunner.java:312)
	at org.testng.SuiteRunnerWorker.runSuite(SuiteRunnerWorker.java:52)
	at org.testng.SuiteRunnerWorker.run(SuiteRunnerWorker.java:95)
	at org.testng.TestNG.runSuitesSequentially(TestNG.java:1274)
	at org.testng.TestNG.runSuitesLocally(TestNG.java:1208)
	at org.testng.TestNG.runSuites(TestNG.java:1112)
	at org.testng.TestNG.run(TestNG.java:1079)
	at org.apache.maven.surefire.testng.TestNGExecutor.run(TestNGExecutor.java:155)
	at org.apache.maven.surefire.testng.TestNGDirectoryTestSuite.executeSingleClass(TestNGDirectoryTestSuite.java:102)
	at org.apache.maven.surefire.testng.TestNGDirectoryTestSuite.execute(TestNGDirectoryTestSuite.java:91)
	at org.apache.maven.surefire.testng.TestNGProvider.invoke(TestNGProvider.java:137)
	at org.apache.maven.surefire.booter.ForkedBooter.runSuitesInProcess(ForkedBooter.java:385)
	at org.apache.maven.surefire.booter.ForkedBooter.execute(ForkedBooter.java:162)
	at org.apache.maven.surefire.booter.ForkedBooter.run(ForkedBooter.java:507)
	at org.apache.maven.surefire.booter.ForkedBooter.main(ForkedBooter.java:495)

[ERROR] com.company.cartify.tests.CartPageTest.testEmptyCartDisplaysMessage -- Time elapsed: 5.029 s <<< FAILURE!
java.lang.AssertionError: Cart should be empty expected [true] but found [false]
	at org.testng.Assert.fail(Assert.java:111)
	at org.testng.Assert.failNotEquals(Assert.java:1578)
	at org.testng.Assert.assertTrue(Assert.java:57)
	at com.company.cartify.tests.CartPageTest.testEmptyCartDisplaysMessage(CartPageTest.java:78)
	at java.base/jdk.internal.reflect.DirectMethodHandleAccessor.invoke(DirectMethodHandleAccessor.java:104)
	at java.base/java.lang.reflect.Method.invoke(Method.java:565)
	at org.testng.internal.invokers.MethodInvocationHelper.invokeMethod(MethodInvocationHelper.java:141)
	at org.testng.internal.invokers.TestInvoker.invokeMethod(TestInvoker.java:686)
	at org.testng.internal.invokers.TestInvoker.invokeTestMethod(TestInvoker.java:230)
	at org.testng.internal.invokers.MethodRunner.runInSequence(MethodRunner.java:63)
	at org.testng.internal.invokers.TestInvoker$MethodInvocationAgent.invoke(TestInvoker.java:992)
	at org.testng.internal.invokers.TestInvoker.invokeTestMethods(TestInvoker.java:203)
	at org.testng.internal.invokers.TestMethodWorker.invokeTestMethods(TestMethodWorker.java:154)
	at org.testng.internal.invokers.TestMethodWorker.run(TestMethodWorker.java:134)
	at java.base/java.util.ArrayList.forEach(ArrayList.java:1604)
	at org.testng.TestRunner.privateRun(TestRunner.java:739)
	at org.testng.TestRunner.run(TestRunner.java:614)
	at org.testng.SuiteRunner.runTest(SuiteRunner.java:421)
	at org.testng.SuiteRunner.runSequentially(SuiteRunner.java:413)
	at org.testng.SuiteRunner.privateRun(SuiteRunner.java:373)
	at org.testng.SuiteRunner.run(SuiteRunner.java:312)
	at org.testng.SuiteRunnerWorker.runSuite(SuiteRunnerWorker.java:52)
	at org.testng.SuiteRunnerWorker.run(SuiteRunnerWorker.java:95)
	at org.testng.TestNG.runSuitesSequentially(TestNG.java:1274)
	at org.testng.TestNG.runSuitesLocally(TestNG.java:1208)
	at org.testng.TestNG.runSuites(TestNG.java:1112)
	at org.testng.TestNG.run(TestNG.java:1079)
	at org.apache.maven.surefire.testng.TestNGExecutor.run(TestNGExecutor.java:155)
	at org.apache.maven.surefire.testng.TestNGDirectoryTestSuite.executeSingleClass(TestNGDirectoryTestSuite.java:102)
	at org.apache.maven.surefire.testng.TestNGDirectoryTestSuite.execute(TestNGDirectoryTestSuite.java:91)
	at org.apache.maven.surefire.testng.TestNGProvider.invoke(TestNGProvider.java:137)
	at org.apache.maven.surefire.booter.ForkedBooter.runSuitesInProcess(ForkedBooter.java:385)
	at org.apache.maven.surefire.booter.ForkedBooter.execute(ForkedBooter.java:162)
	at org.apache.maven.surefire.booter.ForkedBooter.run(ForkedBooter.java:507)
	at org.apache.maven.surefire.booter.ForkedBooter.main(ForkedBooter.java:495)

[ERROR] com.company.cartify.tests.CartPageTest.testStartShoppingRedirectsToProducts -- Time elapsed: 5.045 s <<< FAILURE!
java.lang.AssertionError: Cart must be empty for this test expected [true] but found [false]
	at org.testng.Assert.fail(Assert.java:111)
	at org.testng.Assert.failNotEquals(Assert.java:1578)
	at org.testng.Assert.assertTrue(Assert.java:57)
	at com.company.cartify.tests.CartPageTest.testStartShoppingRedirectsToProducts(CartPageTest.java:101)
	at java.base/jdk.internal.reflect.DirectMethodHandleAccessor.invoke(DirectMethodHandleAccessor.java:104)
	at java.base/java.lang.reflect.Method.invoke(Method.java:565)
	at org.testng.internal.invokers.MethodInvocationHelper.invokeMethod(MethodInvocationHelper.java:141)
	at org.testng.internal.invokers.TestInvoker.invokeMethod(TestInvoker.java:686)
	at org.testng.internal.invokers.TestInvoker.invokeTestMethod(TestInvoker.java:230)
	at org.testng.internal.invokers.MethodRunner.runInSequence(MethodRunner.java:63)
	at org.testng.internal.invokers.TestInvoker$MethodInvocationAgent.invoke(TestInvoker.java:992)
	at org.testng.internal.invokers.TestInvoker.invokeTestMethods(TestInvoker.java:203)
	at org.testng.internal.invokers.TestMethodWorker.invokeTestMethods(TestMethodWorker.java:154)
	at org.testng.internal.invokers.TestMethodWorker.run(TestMethodWorker.java:134)
	at java.base/java.util.ArrayList.forEach(ArrayList.java:1604)
	at org.testng.TestRunner.privateRun(TestRunner.java:739)
	at org.testng.TestRunner.run(TestRunner.java:614)
	at org.testng.SuiteRunner.runTest(SuiteRunner.java:421)
	at org.testng.SuiteRunner.runSequentially(SuiteRunner.java:413)
	at org.testng.SuiteRunner.privateRun(SuiteRunner.java:373)
	at org.testng.SuiteRunner.run(SuiteRunner.java:312)
	at org.testng.SuiteRunnerWorker.runSuite(SuiteRunnerWorker.java:52)
	at org.testng.SuiteRunnerWorker.run(SuiteRunnerWorker.java:95)
	at org.testng.TestNG.runSuitesSequentially(TestNG.java:1274)
	at org.testng.TestNG.runSuitesLocally(TestNG.java:1208)
	at org.testng.TestNG.runSuites(TestNG.java:1112)
	at org.testng.TestNG.run(TestNG.java:1079)
	at org.apache.maven.surefire.testng.TestNGExecutor.run(TestNGExecutor.java:155)
	at org.apache.maven.surefire.testng.TestNGDirectoryTestSuite.executeSingleClass(TestNGDirectoryTestSuite.java:102)
	at org.apache.maven.surefire.testng.TestNGDirectoryTestSuite.execute(TestNGDirectoryTestSuite.java:91)
	at org.apache.maven.surefire.testng.TestNGProvider.invoke(TestNGProvider.java:137)
	at org.apache.maven.surefire.booter.ForkedBooter.runSuitesInProcess(ForkedBooter.java:385)
	at org.apache.maven.surefire.booter.ForkedBooter.execute(ForkedBooter.java:162)
	at org.apache.maven.surefire.booter.ForkedBooter.run(ForkedBooter.java:507)
	at org.apache.maven.surefire.booter.ForkedBooter.main(ForkedBooter.java:495)

[ERROR] com.company.cartify.tests.CartPageTest.testUnableToAddProductToCart -- Time elapsed: 5.035 s <<< FAILURE!
java.lang.AssertionError: Products page should load expected [true] but found [false]
	at org.testng.Assert.fail(Assert.java:111)
	at org.testng.Assert.failNotEquals(Assert.java:1578)
	at org.testng.Assert.assertTrue(Assert.java:57)
	at com.company.cartify.tests.CartPageTest.testUnableToAddProductToCart(CartPageTest.java:130)
	at java.base/jdk.internal.reflect.DirectMethodHandleAccessor.invoke(DirectMethodHandleAccessor.java:104)
	at java.base/java.lang.reflect.Method.invoke(Method.java:565)
	at org.testng.internal.invokers.MethodInvocationHelper.invokeMethod(MethodInvocationHelper.java:141)
	at org.testng.internal.invokers.TestInvoker.invokeMethod(TestInvoker.java:686)
	at org.testng.internal.invokers.TestInvoker.invokeTestMethod(TestInvoker.java:230)
	at org.testng.internal.invokers.MethodRunner.runInSequence(MethodRunner.java:63)
	at org.testng.internal.invokers.TestInvoker$MethodInvocationAgent.invoke(TestInvoker.java:992)
	at org.testng.internal.invokers.TestInvoker.invokeTestMethods(TestInvoker.java:203)
	at org.testng.internal.invokers.TestMethodWorker.invokeTestMethods(TestMethodWorker.java:154)
	at org.testng.internal.invokers.TestMethodWorker.run(TestMethodWorker.java:134)
	at java.base/java.util.ArrayList.forEach(ArrayList.java:1604)
	at org.testng.TestRunner.privateRun(TestRunner.java:739)
	at org.testng.TestRunner.run(TestRunner.java:614)
	at org.testng.SuiteRunner.runTest(SuiteRunner.java:421)
	at org.testng.SuiteRunner.runSequentially(SuiteRunner.java:413)
	at org.testng.SuiteRunner.privateRun(SuiteRunner.java:373)
	at org.testng.SuiteRunner.run(SuiteRunner.java:312)
	at org.testng.SuiteRunnerWorker.runSuite(SuiteRunnerWorker.java:52)
	at org.testng.SuiteRunnerWorker.run(SuiteRunnerWorker.java:95)
	at org.testng.TestNG.runSuitesSequentially(TestNG.java:1274)
	at org.testng.TestNG.runSuitesLocally(TestNG.java:1208)
	at org.testng.TestNG.runSuites(TestNG.java:1112)
	at org.testng.TestNG.run(TestNG.java:1079)
	at org.apache.maven.surefire.testng.TestNGExecutor.run(TestNGExecutor.java:155)
	at org.apache.maven.surefire.testng.TestNGDirectoryTestSuite.executeSingleClass(TestNGDirectoryTestSuite.java:102)
	at org.apache.maven.surefire.testng.TestNGDirectoryTestSuite.execute(TestNGDirectoryTestSuite.java:91)
	at org.apache.maven.surefire.testng.TestNGProvider.invoke(TestNGProvider.java:137)
	at org.apache.maven.surefire.booter.ForkedBooter.runSuitesInProcess(ForkedBooter.java:385)
	at org.apache.maven.surefire.booter.ForkedBooter.execute(ForkedBooter.java:162)
	at org.apache.maven.surefire.booter.ForkedBooter.run(ForkedBooter.java:507)
	at org.apache.maven.surefire.booter.ForkedBooter.main(ForkedBooter.java:495)

[ERROR] com.company.cartify.tests.CartPageTest.testProceedToCheckoutButton -- Time elapsed: 10.53 s <<< FAILURE!
java.lang.AssertionError: User should be redirected to Checkout Page expected [true] but found [false]
	at org.testng.Assert.fail(Assert.java:111)
	at org.testng.Assert.failNotEquals(Assert.java:1578)
	at org.testng.Assert.assertTrue(Assert.java:57)
	at com.company.cartify.tests.CartPageTest.testProceedToCheckoutButton(CartPageTest.java:226)
	at java.base/jdk.internal.reflect.DirectMethodHandleAccessor.invoke(DirectMethodHandleAccessor.java:104)
	at java.base/java.lang.reflect.Method.invoke(Method.java:565)
	at org.testng.internal.invokers.MethodInvocationHelper.invokeMethod(MethodInvocationHelper.java:141)
	at org.testng.internal.invokers.TestInvoker.invokeMethod(TestInvoker.java:686)
	at org.testng.internal.invokers.TestInvoker.invokeTestMethod(TestInvoker.java:230)
	at org.testng.internal.invokers.MethodRunner.runInSequence(MethodRunner.java:63)
	at org.testng.internal.invokers.TestInvoker$MethodInvocationAgent.invoke(TestInvoker.java:992)
	at org.testng.internal.invokers.TestInvoker.invokeTestMethods(TestInvoker.java:203)
	at org.testng.internal.invokers.TestMethodWorker.invokeTestMethods(TestMethodWorker.java:154)
	at org.testng.internal.invokers.TestMethodWorker.run(TestMethodWorker.java:134)
	at java.base/java.util.ArrayList.forEach(ArrayList.java:1604)
	at org.testng.TestRunner.privateRun(TestRunner.java:739)
	at org.testng.TestRunner.run(TestRunner.java:614)
	at org.testng.SuiteRunner.runTest(SuiteRunner.java:421)
	at org.testng.SuiteRunner.runSequentially(SuiteRunner.java:413)
	at org.testng.SuiteRunner.privateRun(SuiteRunner.java:373)
	at org.testng.SuiteRunner.run(SuiteRunner.java:312)
	at org.testng.SuiteRunnerWorker.runSuite(SuiteRunnerWorker.java:52)
	at org.testng.SuiteRunnerWorker.run(SuiteRunnerWorker.java:95)
	at org.testng.TestNG.runSuitesSequentially(TestNG.java:1274)
	at org.testng.TestNG.runSuitesLocally(TestNG.java:1208)
	at org.testng.TestNG.runSuites(TestNG.java:1112)
	at org.testng.TestNG.run(TestNG.java:1079)
	at org.apache.maven.surefire.testng.TestNGExecutor.run(TestNGExecutor.java:155)
	at org.apache.maven.surefire.testng.TestNGDirectoryTestSuite.executeSingleClass(TestNGDirectoryTestSuite.java:102)
	at org.apache.maven.surefire.testng.TestNGDirectoryTestSuite.execute(TestNGDirectoryTestSuite.java:91)
	at org.apache.maven.surefire.testng.TestNGProvider.invoke(TestNGProvider.java:137)
	at org.apache.maven.surefire.booter.ForkedBooter.runSuitesInProcess(ForkedBooter.java:385)
	at org.apache.maven.surefire.booter.ForkedBooter.execute(ForkedBooter.java:162)
	at org.apache.maven.surefire.booter.ForkedBooter.run(ForkedBooter.java:507)
	at org.apache.maven.surefire.booter.ForkedBooter.main(ForkedBooter.java:495)

[ERROR] com.company.cartify.tests.CartPageTest.testContinueShoppingButton -- Time elapsed: 20.72 s <<< FAILURE!
java.lang.AssertionError: User should be redirected to Products Page expected [true] but found [false]
	at org.testng.Assert.fail(Assert.java:111)
	at org.testng.Assert.failNotEquals(Assert.java:1578)
	at org.testng.Assert.assertTrue(Assert.java:57)
	at com.company.cartify.tests.CartPageTest.testContinueShoppingButton(CartPageTest.java:255)
	at java.base/jdk.internal.reflect.DirectMethodHandleAccessor.invoke(DirectMethodHandleAccessor.java:104)
	at java.base/java.lang.reflect.Method.invoke(Method.java:565)
	at org.testng.internal.invokers.MethodInvocationHelper.invokeMethod(MethodInvocationHelper.java:141)
	at org.testng.internal.invokers.TestInvoker.invokeMethod(TestInvoker.java:686)
	at org.testng.internal.invokers.TestInvoker.invokeTestMethod(TestInvoker.java:230)
	at org.testng.internal.invokers.MethodRunner.runInSequence(MethodRunner.java:63)
	at org.testng.internal.invokers.TestInvoker$MethodInvocationAgent.invoke(TestInvoker.java:992)
	at org.testng.internal.invokers.TestInvoker.invokeTestMethods(TestInvoker.java:203)
	at org.testng.internal.invokers.TestMethodWorker.invokeTestMethods(TestMethodWorker.java:154)
	at org.testng.internal.invokers.TestMethodWorker.run(TestMethodWorker.java:134)
	at java.base/java.util.ArrayList.forEach(ArrayList.java:1604)
	at org.testng.TestRunner.privateRun(TestRunner.java:739)
	at org.testng.TestRunner.run(TestRunner.java:614)
	at org.testng.SuiteRunner.runTest(SuiteRunner.java:421)
	at org.testng.SuiteRunner.runSequentially(SuiteRunner.java:413)
	at org.testng.SuiteRunner.privateRun(SuiteRunner.java:373)
	at org.testng.SuiteRunner.run(SuiteRunner.java:312)
	at org.testng.SuiteRunnerWorker.runSuite(SuiteRunnerWorker.java:52)
	at org.testng.SuiteRunnerWorker.run(SuiteRunnerWorker.java:95)
	at org.testng.TestNG.runSuitesSequentially(TestNG.java:1274)
	at org.testng.TestNG.runSuitesLocally(TestNG.java:1208)
	at org.testng.TestNG.runSuites(TestNG.java:1112)
	at org.testng.TestNG.run(TestNG.java:1079)
	at org.apache.maven.surefire.testng.TestNGExecutor.run(TestNGExecutor.java:155)
	at org.apache.maven.surefire.testng.TestNGDirectoryTestSuite.executeSingleClass(TestNGDirectoryTestSuite.java:102)
	at org.apache.maven.surefire.testng.TestNGDirectoryTestSuite.execute(TestNGDirectoryTestSuite.java:91)
	at org.apache.maven.surefire.testng.TestNGProvider.invoke(TestNGProvider.java:137)
	at org.apache.maven.surefire.booter.ForkedBooter.runSuitesInProcess(ForkedBooter.java:385)
	at org.apache.maven.surefire.booter.ForkedBooter.execute(ForkedBooter.java:162)
	at org.apache.maven.surefire.booter.ForkedBooter.run(ForkedBooter.java:507)
	at org.apache.maven.surefire.booter.ForkedBooter.main(ForkedBooter.java:495)

[INFO] 
[INFO] Results:
[INFO] 
[ERROR] Failures: 
[ERROR]   CartPageTest.testCartPageLoadsSuccessfully:43 Cart container should be displayed expected [true] but found [false]
[ERROR]   CartPageTest.testContinueShoppingButton:255 User should be redirected to Products Page expected [true] but found [false]
[ERROR]   CartPageTest.testEmptyCartDisplaysMessage:78 Cart should be empty expected [true] but found [false]
[ERROR]   CartPageTest.testProceedToCheckoutButton:226 User should be redirected to Checkout Page expected [true] but found [false]
[ERROR]   CartPageTest.testStartShoppingRedirectsToProducts:101 Cart must be empty for this test expected [true] but found [false]
[ERROR]   CartPageTest.testUnableToAddProductToCart:130 Products page should load expected [true] but found [false]
[INFO] 
[ERROR] Tests run: 7, Failures: 6, Errors: 0, Skipped: 0
[INFO] 
[INFO] ------------------------------------------------------------------------
[INFO] BUILD FAILURE
[INFO] ------------------------------------------------------------------------
[INFO] Total time:  01:11 min
[INFO] Finished at: 2025-11-30T23:01:09+02:00
[INFO] ------------------------------------------------------------------------
[ERROR] Failed to execute goal org.apache.maven.plugins:maven-surefire-plugin:3.2.2:test (default-test) on project auto: There are test failures.
[ERROR] 
[ERROR] Please refer to /Users/abdallah/Java Automaiton/java-Automation/auto/target/surefire-reports for the individual test results.
[ERROR] Please refer to dump files (if any exist) [date].dump, [date]-jvmRun[N].dump and [date].dumpstream.
[ERROR] -> [Help 1]
[ERROR] 
[ERROR] To see the full stack trace of the errors, re-run Maven with the -e switch.
[ERROR] Re-run Maven using the -X switch to enable full debug logging.
[ERROR] 
[ERROR] For more information about the errors and possible solutions, please read the following articles:
[ERROR] [Help 1] http://cwiki.apache.org/confluence/display/MAVEN/MojoFailureException
